<!--

    #-=-=-=-=-=-=-=-=-=-=-=-=-=-=-=-=-=-=-=-=-=-=-=-=-=-=-=-=-=-=-=-=-=-=-=-=-=#
      This file is part of the LDP4j Project:
        http://www.ldp4j.org/

      Center for Open Middleware
        http://www.centeropenmiddleware.com/
    #-=-=-=-=-=-=-=-=-=-=-=-=-=-=-=-=-=-=-=-=-=-=-=-=-=-=-=-=-=-=-=-=-=-=-=-=-=#
      Copyright (C) 2014 Center for Open Middleware.
    #-=-=-=-=-=-=-=-=-=-=-=-=-=-=-=-=-=-=-=-=-=-=-=-=-=-=-=-=-=-=-=-=-=-=-=-=-=#
      Licensed under the Apache License, Version 2.0 (the "License");
      you may not use this file except in compliance with the License.
      You may obtain a copy of the License at

                http://www.apache.org/licenses/LICENSE-2.0

      Unless required by applicable law or agreed to in writing, software
      distributed under the License is distributed on an "AS IS" BASIS,
      WITHOUT WARRANTIES OR CONDITIONS OF ANY KIND, either express or implied.
      See the License for the specific language governing permissions and
      limitations under the License.
    #-=-=-=-=-=-=-=-=-=-=-=-=-=-=-=-=-=-=-=-=-=-=-=-=-=-=-=-=-=-=-=-=-=-=-=-=-=#
      Artifact    : org.ldp4j.framework:ldp4j-application-persistency:1.0.0-SNAPSHOT
      Bundle      : ldp4j-application-persistency-1.0.0-SNAPSHOT.jar
    #-=-=-=-=-=-=-=-=-=-=-=-=-=-=-=-=-=-=-=-=-=-=-=-=-=-=-=-=-=-=-=-=-=-=-=-=-=#

-->
<!DOCTYPE dataset SYSTEM "database-schema.dtd">
<dataset>

	<Application path="deletable_path" name="My Deleteable Application"/>

	<!-- Templates without attachments -->
	<Template template_id="10001" handlerClassName="org.ldp4j.application.MyRDFSourceTemplate" name="MyRDFSourceTemplate" description="A RDF source template" app_path="deletable_path"/>
	<Template template_id="10002" handlerClassName="org.ldp4j.application.MyBasicContainerTemplate" name="MyBasicContainerTemplate" description="A Basic Container Template" app_path="deletable_path"/>
	<Template template_id="10003" handlerClassName="org.ldp4j.application.MyDirectContainerTemplate" name="MyDirectContainerTemplate" description="A Direct Container Template" app_path="deletable_path"/>
	<Template template_id="10004" handlerClassName="org.ldp4j.application.MyIndirectContainerTemplate" name="MyIndirectContainerTemplate" description="An Indirect Container Template" app_path="deletable_path"/>

	<!-- Templates with attachments -->
	<Template template_id="100051" handlerClassName="org.ldp4j.application.MyAttachingRDFSourceTemplate" name="MyAttachingRDFSourceTemplate" description="An RDF source template with Attachments" app_path="deletable_path"/>
	<Template template_id="100052" handlerClassName="org.ldp4j.application.MyAttachingBasicContainerTemplate" name="MyAttachingBasicContainerTemplate" description="A Basic Container Template with Attachments" app_path="deletable_path"/>
	<Template template_id="100053" handlerClassName="org.ldp4j.application.MyAttachingDirectContainerTemplate" name="MyAttachingDirectContainerTemplate" description="A Direct Container Template with Attachments" app_path="deletable_path"/>
	<Template template_id="100054" handlerClassName="org.ldp4j.application.MyAttachingIndirectContainerTemplate" name="MyAttachingIndirectContainerTemplate" description="An Indirect Container Template with Attachments" app_path="deletable_path"/>

	<TemplateAttachment attachment_id="10001" name="RDFSource" path="rdf_source" owner_template_id="100051" attached_template_id="10001" />
	<TemplateAttachment attachment_id="10002" name="BasicContainer" path="basic_container" owner_template_id="100051" attached_template_id="10002"/>
	<TemplateAttachment attachment_id="10003" name="DirectContainer" path="direct_container" owner_template_id="100051" attached_template_id="10003"/>
	<TemplateAttachment attachment_id="10004" name="IndirectContainer" path="indirect_container" owner_template_id="100051" attached_template_id="10004"/>

	<RDFSourceTemplate template_id="10001" />
	<RDFSourceTemplate template_id="10002" />
	<RDFSourceTemplate template_id="10003" />
	<RDFSourceTemplate template_id="10004" />

	<RDFSourceTemplate template_id="100051" />
	<RDFSourceTemplate template_id="100052" />
	<RDFSourceTemplate template_id="100053" />
	<RDFSourceTemplate template_id="100054" />

	<BasicContainerTemplate template_id="10002" member_template_id="10001" />
	<BasicContainerTemplate template_id="100052" member_template_id="100051" />

	<DirectContainerTemplate template_id="10003" member_template_id="10001"  membershipPredicate="http://www.ldp4j.org/vocab#hasMember" membershipRelation="HAS_MEMBER"/>
	<DirectContainerTemplate template_id="100053" member_template_id="100051"  membershipPredicate="http://www.ldp4j.org/vocab#hasMember" membershipRelation="HAS_MEMBER"/>

	<IndirectContainerTemplate template_id="10004" member_template_id="10001"  membershipPredicate="http://www.ldp4j.org/vocab#isMemberOf" membershipRelation="IS_MEMBER_OF" insertedContentRelation="http://www.ldp4j.org/vocab#id"/>
	<IndirectContainerTemplate template_id="100054" member_template_id="100051"  membershipPredicate="http://www.ldp4j.org/vocab#isMemberOf" membershipRelation="IS_MEMBER_OF" insertedContentRelation="http://www.ldp4j.org/vocab#id"/>

</dataset>